{
  "schema_version": "1.1.0",
  "source_id": "EU-2004-38",
  "source_revision": "0.1.0",
  "url": "https://eur-lex.europa.eu/legal-content/EN/ALL/?uri=CELEX:32004L0038",
  "authority": "European Union / EUR-Lex",
  "title": "Directive 2004/38/EC",
  "source_type": "Legislation",
  "language": null,
  "official_status": "UNCONFIRMED",
  "official_status_basis": "Identified as an approved official source by the user-supplied external review. Independent provenance verification and its date were not supplied; not performed during encoding.",
  "retrieved_at": null,
  "verified_at": null,
  "source_version": null,
  "consolidation_date": null,
  "published_at": null,
  "effective_from": null,
  "effective_to": null,
  "effective_date_known": false,
  "effective_date_notes": "Not supplied. Consolidation identifiers, where present, are not effective-date determinations.",
  "reference_copy": null,
  "reviewer_notes": "Registered from the supplied EP001-01 review only; no browsing, direct source retrieval, verbatim excerpt, reference copy, or named reviewer supplied. Applicable version remains to be established."
}
